<!ELEMENT BOARD (NAME, ARTICLE+)>
<!ELEMENT NAME (#PCDATA)>
<!ELEMENT ARTICLE (TITLE, MESSAGE, WRITER_ID, WRITER_NAME, REPLY*)>
<!ELEMENT TITLE (#PCDATA)>
<!ELEMENT REPLY (MESSAGE, WRITER_ID, WRITER_NAME)>
<!ELEMENT MESSAGE (#PCDATA)>
<!ELEMENT WRITER_ID (#PCDATA)>
<!ELEMENT WRITER_NAME (#PCDATA)>